id,date,content,link
1,2022-03-05,香港新增37529例新冠肺炎确诊病例,http://www.sohu.com/a/527490110_313745
2,2022-03-05,吉林省部署做好疫情防控状态下安全防范工作,http://www.sohu.com/a/527484476_121106822
3,2022-03-05,浙江嘉善县划定疫情防控封控区、管控区、防控区,http://news.sina.com.cn/c/2022-03-05/doc-imcwiwss4362846.shtml
4,2022-03-05,重庆新增境外输入确诊病例1例,http://www.sohu.com/a/527465939_121106884
5,2022-03-05,疫情之下广西防城港市六人走私羚羊角被批捕,http://finance.sina.com.cn/jjxw/2022-03-05/doc-imcwiwss4348447.shtml
6,2022-03-05,辽宁无新增本土新冠肺炎确诊病例,http://baijiahao.baidu.com/s?id=1726448376018618720&wfr=spider&for=pc
7,2022-03-05,江苏连云港市3月4日晚确诊病例行程轨迹及封控区域,http://www.163.com/dy/article/H1N5OAKR0535M93I.html
8,2022-03-05,山东莱西七中师生新增确诊病例11例,http://baijiahao.baidu.com/s?id=1726438971563803689&wfr=spider&for=pc
9,2022-03-05,我国新冠疫苗全程接种率超过87%,http://baijiahao.baidu.com/s?id=1726443874332269103&wfr=spider&for=pc
10,2022-03-05,吉林市城区明日启动第二轮核酸检测,http://www.163.com/dy/article/H1N3JKJT0534A4SC.html
11,2022-03-05,海南三亚发布进一步加强疫情防控期间医疗服务保障工作的温馨提示,http://finance.sina.com.cn/jjxw/2022-03-05/doc-imcwipih6782255.shtml
12,2022-03-05,吉林蛟河市新冠肺炎疫情防控通告,http://www.163.com/dy/article/H1N2194S0534C06D.html
13,2022-03-05,重庆将启动适龄女生免费接种HPV疫苗工作,http://www.cq.xinhuanet.com/2022-03/05/c_1128440790.htm
14,2022-03-05,河北新增6例本土确诊病例、1例本土无症状感染者,http://www.xhyb.net.cn/focus/2022/0305/175848.html
15,2022-03-05,吉林市文联志愿者下沉社区助力核酸检测,http://jl.news.163.com/22/0305/13/H1MSJDII041197VA.html
16,2022-03-05,内蒙古包头青山区急寻确诊病例曾某某密切接触者,http://www.cnhubei.com/content/2022-03/05/content_14550004.html
17,2022-03-05,今天香港疫情最新通报：新增确诊5万例 死亡人数136人,http://www.mnw.cn/news/shehui/2596228.html
18,2022-03-05,江苏启动新冠疫苗序贯加强免疫疾控专家回应公众关心问题,http://baijiahao.baidu.com/s?id=1726428492727879588&wfr=spider&for=pc
19,2022-03-05,昨日吉林省新增本地确诊病例19例,http://www.cnr.cn/jlfw/jlyw1/20220305/t20220305_525757422.shtml
20,2022-03-05,山东德州公布新冠肺炎密接者行程轨迹,http://news.cri.cn/wifihezuo/20220305/94de52ea-7b66-3c0f-7a29-ad648123e1cd.html
21,2022-03-05,吉林市新增8例本土确诊病例、24例本土无症状感染者,http://www.163.com/dy/article/H1MGF5RL0534C06D.html
22,2022-03-05,上海发布：排查和管控是阻断疫情传播的必要措施，请不要担心,http://www.sohu.com/a/527338368_260616
23,2022-03-05,广西昨日新增确诊病例3+4,http://k.sina.com.cn/article_2017957503_7847967f019011xda.html
24,2022-03-05,吉林新增本土确诊24例,http://www.mnw.cn/news/shehui/2596188.html
25,2022-03-05,辽宁治愈出院本土新冠肺炎确诊病例16例,http://k.sina.com.cn/article_1368805177_51964f3904000z66x.html
26,2022-03-05,湖北武汉通告4日确诊病例有关情况及活动场所,http://finance.sina.com.cn/jjxw/2022-03-05/doc-imcwipih6720755.shtml
27,2022-03-05,3月4日贵州省新冠肺炎疫情信息发布,http://www.sohu.com/a/527331195_121106687
28,2022-03-05,山东新增本土确诊5例,http://www.mnw.cn/news/shehui/2596174.html
29,2022-03-05,3月5日安徽省报告新冠肺炎疫情情况,http://www.sohu.com/a/527323675_121106991
30,2022-03-05,山东昨日新增确诊病例14例,http://baijiahao.baidu.com/s?id=1726416398347909923&wfr=spider&for=pc
31,2022-03-05,北京3月4日无新增本土确诊病例、疑似病例和无症状感染者,http://stock.10jqka.com.cn/20220305/c637223130.shtml
32,2022-03-05,内蒙古满洲里市寻找一确诊病例密切接触者,http://baijiahao.baidu.com/s?id=1726411104276806364&wfr=spider&for=pc
33,2022-03-05,3月5日湖北最新疫情数据消息发布,http://www.topnews9.com/yqfk/202203/98940.html
34,2022-03-05,3月5日北京最新疫情数据消息发布,http://www.topnews9.com/yqfk/202203/98939.html
35,2022-03-05,江苏苏州吴江区解除全域疫情防范区,http://finance.sina.com.cn/jjxw/2022-03-05/doc-imcwiwss4238940.shtml
36,2022-03-05,香港新增52523例新冠肺炎确诊病例,http://news.haiwainet.cn/n/2022/0305/c3541083-32356203.html
