id,date,content,link
1,2022-03-17,山东青岛昨日新增本土确诊病例10例,http://www.jiemian.com/article/7220148.html
2,2022-03-17,山东威海昨日新增本土确诊病例6例,http://www.jiemian.com/article/7220140.html
3,2022-03-17,山东淄博昨日新增本土确诊病例1例、无症状感染者15例,http://www.jiemian.com/article/7220133.html
4,2022-03-17,台湾新增90例新冠肺炎确诊病例,http://baijiahao.baidu.com/s?id=1727500250247713217&wfr=spider&for=pc
5,2022-03-17,3月17日最新疫情防控消息西藏数据公布,http://www.3jrx.com/yqzt/202203/338209.html
6,2022-03-17,山东昨日新增36例本土确诊病例及96例本土无症状感染者,http://baijiahao.baidu.com/s?id=1727499475474013355&wfr=spider&for=pc
7,2022-03-17,山东新冠抗原检测试剂均价降至九元以下,http://sd.dzwww.com/sdnews/202203/t20220317_9966901.htm
8,2022-03-17,云南3月16日新增本土确诊病例5例、本土无症状感染者24例,http://www.jiemian.com/article/7220059.html
9,2022-03-17,江苏查处多起妨害疫情防控违法行为,http://jsnews.jschina.com.cn/jsyw/202203/t20220317_2963769.shtml
10,2022-03-17,江苏省疾控中心专家：现阶段新冠疫苗防护作用仍有效,http://jsnews.jschina.com.cn/jsyw/202203/t20220317_2963768.shtml
11,2022-03-17,3月17日06时青海新型冠状病毒肺炎疫情最新消息公布,http://www.3jrx.com/yqzt/202203/337501.html
12,2022-03-17,吉林省慈善总会公布疫情防控捐赠渠道,http://www.163.com/dy/article/H2KQ3H750552DUC8.html
13,2022-03-17,3月17日04时山东新型冠状病毒肺炎疫情最新消息公布,http://www.3jrx.com/yqzt/202203/336382.html
14,2022-03-17,3月17日04时北京疫情防疫最新数据消息公布,http://www.3jrx.com/yqzt/202203/336276.html
15,2022-03-17,云南瑞丽：疫情处置期间对部分区域实施封闭管理,http://finance.sina.com.cn/jjxw/2022-03-17/doc-imcwipih8927763.shtml
16,2022-03-17,3月17日02时北京疫情防疫最新数据消息公布,http://www.3jrx.com/yqzt/202203/335002.html
17,2022-03-17,广东疫情再次“爆发”,http://www.163.com/dy/article/H2KHAH7A0551MGVW.html
18,2022-03-17,江苏盐城大中街道全面激活街道疫情防控组织体系,http://baijiahao.baidu.com/s?id=1727478190516212069&wfr=spider&for=pc
19,2022-03-17,浙江一地新增30例确诊病例,http://www.163.com/dy/article/H2KF9IBT0534JIG6.html
20,2022-03-17,天津新增11例境外输入确诊病例,http://finance.sina.com.cn/jjxw/2022-03-17/doc-imcwiwss6470229.shtml
21,2022-03-17,吉林市17日启动第11轮核酸检测,http://finance.sina.com.cn/jjxw/2022-03-17/doc-imcwipih8916482.shtml
22,2022-03-16,吉林延边珲春市新增无症状感染者3例,http://finance.sina.com.cn/jjxw/2022-03-16/doc-imcwiwss6466454.shtml
23,2022-03-16,宁光院士：上海交大闵行校区疫情防控已到关键窗口期、决胜期,http://www.thepaper.cn/newsDetail_forward_17151328
24,2022-03-16,国药医工总院志愿者踊跃支援上海核酸检测任务,http://finance.sina.com.cn/jjxw/2022-03-16/doc-imcwipih8913470.shtml
25,2022-03-16,广东东莞新增7例本土新冠肺炎确诊病例,http://finance.ifeng.com/c/8ERJCNv5k5A
26,2022-03-16,3月16日贵州省火车站出站进站疫情政策汇总出炉,http://www.163.com/dy/article/H2K8E41K05259QRI.html
27,2022-03-16,海南研究部署民政系统疫情防控工作,http://www.zhongguojinrongtouziwang.com/yqzl/202203/242383.html
28,2022-03-16,老百姓大药房天津门店已开售新冠抗原检测产品,http://www.163.com/dy/article/H2K7SJ64053469RJ.html
29,2022-03-16,山东新闻联播：山东加大疫情期间民生保障 确保生活平稳有序,http://hb.dzwww.com/p/p16Jel0dCd.html
30,2022-03-16,吉林省公布疫情期间第三批价格违法典型案例,http://www.sohu.com/a/530380936_120640988
31,2022-03-16,陕西：疫情当前 众志成城 三原法警在行动,http://www.163.com/dy/article/H2K6A7UI0552WYH1.html
32,2022-03-16,澳门规定网购代收店工作人员须每七天进行一次核酸检测,http://www.jiemian.com/article/7219552.html
33,2022-03-16,中国内地日增本土确诊连续4天破千例,http://news.sina.com.cn/o/2022-03-16/doc-imcwipih8903773.shtml
34,2022-03-16,3月16日22时黑龙江最新疫情数据消息公示,http://www.3jrx.com/yqzt/202203/332195.html
35,2022-03-16,宁夏交通运输系统从严从紧抓好疫情防控工作,http://k.sina.com.cn/article_2118205862_7e4141a6020010537.html
36,2022-03-16,云南从严查处未经许可生产经营新冠病毒抗原检测试剂违法违规行为,http://www.163.com/dy/article/H2K2B41I0514R9NO.html
37,2022-03-16,国药控股山西有限公司运城分公司为我县捐赠疫情防控物资,http://www.sohu.com/a/530359230_121106854
38,2022-03-16,青海省海西州乌兰县疫情防控青年志愿者招募公告,http://www.sohu.com/a/530358407_121106869
39,2022-03-16,上海静安区彭浦镇免费核酸检测通知,http://sh.bendibao.com/news/2022316/249750.shtm
