id,date,content,link
1,2022-02-26,山西省精神卫生中心紧急驰援疫情防控一线,http://sx.news.163.com/22/0226/17/H159FVOE04149A58.html
2,2022-02-26,香港本轮疫情逾8.1万人确诊,http://finance.sina.com.cn/jjxw/2022-02-26/doc-imcwiwss3070731.shtml
3,2022-02-26,香港新增17063例新冠肺炎确诊病例,http://www.thepaper.cn/newsDetail_forward_16870200
4,2022-02-26,内蒙古呼和浩特市新增本土确诊病例22例,http://www.sohu.com/a/525675324_120646855
5,2022-02-26,辽宁新增10例本土新冠肺炎确诊病例,http://news.haiwainet.cn/n/2022/0226/c3541083-32350827.html
6,2022-02-26,广东深圳2月25日新增18例确诊病例,http://news.haiwainet.cn/n/2022/0226/c3541083-32350826.html
7,2022-02-26,吴良有：中央政府将继续全力支持香港的疫情防控,http://www.sohu.com/a/525670676_267106
8,2022-02-26,国家卫健委回应香港疫情,http://www.163.com/dy/article/H154M3LO05129QAF.html
9,2022-02-26,云南镇康公布昨日新增2例确诊病例和11例无症状感染者详情,http://finance.sina.com.cn/jjxw/2022-02-26/doc-imcwiwss3059504.shtml
10,2022-02-26,内蒙古自治区总工会慰问核酸检测点医护人员,http://www.sohu.com/a/525670190_257321
11,2022-02-26,国家卫健委：四川成都、广西防城港疫情存在进一步传播扩散风险,http://www.163.com/dy/article/H1534M2K0534A4SC.html
12,2022-02-26,中国驻瑞士使馆调整赴华人员登机前新冠病毒检测要求,http://www.chinaqw.com/qwxs/2022/02-26/323202.shtml
13,2022-02-26,凯普集团向香港捐赠11万份新冠抗原检测试剂,http://stock.10jqka.com.cn/20220226/c637039821.shtml
14,2022-02-26,台湾新增69例新冠病例,http://www.jiemian.com/article/7147377.html
15,2022-02-26,天津东丽区新增1例本土确诊病例,http://news.hbtv.com.cn/p/2142996.html
16,2022-02-26,广西防城港市公布确诊病例1至16的分布情况,http://k.sina.com.cn/article_3514732862_d17e913e040010bta.html
17,2022-02-26,广西防城港本轮疫情累计报告本土确诊16例,http://baijiahao.baidu.com/s?id=1725803413695109921&wfr=spider&for=pc
18,2022-02-26,内蒙古巴彦淖尔市临河区重点区域人员核酸检测结果均为阴性,http://finance.sina.com.cn/jjxw/2022-02-26/doc-imcwiwss3041438.shtml
19,2022-02-26,内蒙古现有本土确诊病例327例,http://baijiahao.baidu.com/s?id=1725800333037116701&wfr=spider&for=pc
20,2022-02-26,四川出现疫情反弹,http://www.163.com/dy/article/H14PI5NS0552D7RN.html
21,2022-02-26,广西防城港、广东东莞和深圳报告多例确诊病例,http://k.sina.com.cn/article_5288053096_13b314968001010bwl.html
22,2022-02-26,中国驻奥克兰总领馆：新西兰疫情严重，赴华之前需做好这些事,http://www.163.com/dy/article/H14NS91K0514DF2I.html
23,2022-02-26,山西太原一男子违反疫情防控规定被行政拘留,http://www.cnr.cn/sx/sxgz/20220226/t20220226_525751323.shtml
24,2022-02-26,泉州：全力支持香港泉籍乡亲防抗疫情,http://www.sohu.com/a/525624323_121106994
25,2022-02-26,云南新增17例本土无症状感染者,http://m.thepaper.cn/newsDetail_forward_16867544
26,2022-02-26,四川昨日新增两例本土确诊病例,http://tv.cctv.com/2022/02/26/VIDEhFsu5aN2FKQtyUUc8A5m220226.shtml
27,2022-02-26,江苏昨日新增本土确诊病例4例,http://www.sohu.com/a/525578088_121286085
28,2022-02-26,辽宁葫芦岛市昨日4名确诊病例治愈出院,http://news.cctv.com/2022/02/26/ARTIROZihB9fCQBduEFifRFj220226.shtml
29,2022-02-26,江苏兴化通报疫情防控典型案例,http://js.people.com.cn/n2/2022/0226/c360303-35151002.html
30,2022-02-26,山西卫视到我司采访疫情防控工作,http://baijiahao.baidu.com/s?id=1725786824246518475&wfr=spider&for=pc
31,2022-02-26,内蒙古公益事业发展基金会助力疫情防控在行动,http://k.sina.com.cn/article_2810373291_a782e4ab02002aic5.html
32,2022-02-26,浙江2月25日新增境外输入病例“4+2”例,http://baijiahao.baidu.com/s?id=1725786093582284487&wfr=spider&for=pc
33,2022-02-26,河南2月25日无新增确诊病例,http://www.sohu.com/a/525567732_120347736
34,2022-02-26,上海新增55例境外输入病例,http://sh.sina.com.cn/news/k/2022-02-26/detail-imcwipih5439886.shtml
35,2022-02-26,内蒙古各级国库拨付疫情防控资金1.29亿,http://www.northnews.cn/2022/0226/2072723.html
36,2022-02-26,广东昨日新增本土确诊病例30例,http://finance.ifeng.com/c/8DwSG4NWG7U
37,2022-02-26,2月26日安徽省报告新冠肺炎疫情情况,http://www.sohu.com/a/525557821_121106991
38,2022-02-26,广西防城港防城区新增8例新冠病毒核酸检测阳性人员,http://news.xmnn.cn/xmnn/2022/02/26/101010473.shtml
