id,date,content,link
1,2021-12-31,广西两男子因疫情被判刑,http://www.163.com/dy/article/GSH9IJOA0552E6JA.html
2,2021-12-30,广西东兴：加强边境疫情防控,http://www.sohu.com/a/513360982_267106
3,2021-12-30,吴晓波：疫情以后中国的办公协同市场迅猛增长 领先于美国,http://finance.sina.com.cn/hy/hyjz/2021-12-30/doc-ikyamrmz2238116.shtml
4,2021-12-30,云南：预计春运旅客发送量3408万人次 确保疫情不因春运扩散,http://www.163.com/dy/article/GSGG44MF0514R9NO.html
5,2021-12-30,天津第148例本土确诊病例今天出院,http://www.sohu.com/a/513356811_571524
6,2021-12-30,澳门调整四项疫情防控措施,http://www.chinanews.com/ga/2021/12-30/9641234.shtml
7,2021-12-30,广东进一步降低疾控机构核酸检测收费标准,http://k.sina.com.cn/article_1750553234_685752920200150qs.html
8,2021-12-30,国家电网董事长辛保安为支援陕西抗击疫情保供电队伍壮行,http://finance.sina.com.cn/jjxw/2021-12-30/doc-ikyakumx7413477.shtml
9,2021-12-30,海南强化细化疫情防控保障工作,http://k.sina.com.cn/article_2035413034_m7951f02a02000woyz.html
10,2021-12-30,北京市文旅局：关于酒店要严格执行常态化疫情防控措施的通知,http://www.163.com/dy/article/GSG9IT9R05389YET.html
11,2021-12-30,广东新规：新冠核酸单样检测最高40元,http://k.sina.com.cn/article_1652484947_627eeb5302001ahti.html
12,2021-12-30,重庆石柱冷水国际滑雪场入场疫情防控公告,http://cq.bendibao.com/tour/20211230/104428.shtm
13,2021-12-30,孙颖莎、刘国梁、中国乒乓球国家队解除疫情隔离了,http://www.163.com/dy/article/GSG5P84N05498P0T.html
14,2021-12-30,陕西省知识产权局：党员干部下沉社区参与抗击疫情,http://news.cnwest.com/sxxw/a/2021/12/30/20201777.html
15,2021-12-30,关于做好贵州省铜仁市返（来）通化县人员疫情防控工作的通告,http://www.sohu.com/a/513317191_121106822
16,2021-12-30,青海：严格限制省内人员前往中高风险地区和发生疫情的地区,http://china.huanqiu.com/article/46CRltpBbXv
17,2021-12-30,驻加蓬使馆提醒在加中国公民元旦春节期间做好疫情防控和安全防范,http://k.sina.com.cn/article_7517400647_1c0126e47059027n42.html
18,2021-12-30,广西东兴：因疫情滞留人员申请返程 这些信息要知道,http://china.huanqiu.com/article/46CPeYdtGJB
19,2021-12-30,台湾新增境外移入确诊病例创今年单日新高,http://www.chinanews.com/tw/2021/12-30/9641018.shtml
20,2021-12-30,河南周口地龙受疫情和进口货流入市场影响,http://www.zyctd.com/zixun/201/801558.html
21,2021-12-30,2021下半年云南临沧市教师资格考试（面试）疫情防控公告,http://www.offcn.com/jiaoshi/2021/1230/493856.html
22,2021-12-30,蒙自市设分会场参加云南省集中隔离点疫情防控案例分析视频会,http://k.sina.com.cn/article_1787043322_6a841dfa02000zp4t.html
23,2021-12-30,陕西财经职业技术学院青年学生投身疫情防控志愿服务工作,http://www.163.com/dy/article/GSFTEN9905363IFS.html
24,2021-12-30,宁夏文化和旅游厅：加强督导巡查力度 坚守疫情防控防线,http://www.sohu.com/a/513249130_121106869
25,2021-12-30,​山西省新冠疫情防控工作领导小组重要通告,http://www.sohu.com/a/513247380_121106854
26,2021-12-30,受疫情影响2022天津跨年部分活动取消或延期,http://www.k1u.com/trip/114768.html
27,2021-12-30,河北机场集团全面部署2022年元旦春节期间疫情防控工作,http://www.caacnews.com.cn/1/5/202112/t20211230_1337158_wap.html
28,2021-12-30,驻越南使馆提醒在越中国公民切实加强疫情防范,http://www.sohu.com/a/513221020_121124428
29,2021-12-30,贵州铜仁中心城区居民核酸检测结果全部为阴性,http://finance.sina.com.cn/jjxw/2021-12-30/doc-ikyakumx7327846.shtml
30,2021-12-30,内蒙古现有本土确诊病例75例,http://www.northnews.cn/2021/1230/2056595.html
31,2021-12-30,山西稷山第三轮核酸检测结果均为阴性,http://sx.people.com.cn/n2/2021/1230/c189132-35075548.html
