id,date,content,link
1,2022-02-17,摩通：香港第五波疫情令社交距离措施收紧，予收租股减持评级,http://baijiahao.baidu.com/s?id=1724999958729989432&wfr=spider&for=pc
2,2022-02-17,广西艺术学院学子积极助力百色疫情防控工作,http://difang.gmw.cn/gx/2022-02/17/content_35525395.htm
3,2022-02-17,内蒙古和林格尔县总工会召开疫情防控工作部署会,http://www.sohu.com/a/523446182_257321
4,2022-02-17,香港2月17日新增约5000例确诊病例,http://henan.china.com.cn/m/2022-02/17/content_41879612.html
5,2022-02-17,以非法途径进入内地的新冠肺炎确诊病例被湖南警方立案调查,http://www.163.com/dy/article/H0DUUGL00514Q0KM.html
6,2022-02-17,香港新冠确诊及初步阳性人数突破 1 万,http://www.sohu.com/a/523434927_121124365
7,2022-02-17,河南卢氏县教体局：扎实做好春季开学前全员核酸检测工作,http://baijiahao.baidu.com/s?id=1724994348872957684&wfr=spider&for=pc
8,2022-02-17,区领导高克军收听收看河北省应对疫情工作视频调度会议,http://baijiahao.baidu.com/s?id=1724994076143349567&wfr=spider&for=pc
9,2022-02-17,广东珠海新增输入1例确诊病例1例无症状感染者,http://k.sina.com.cn/article_5637065453_m14ffecaed033017ibl.html
10,2022-02-17,台湾地区今天通报新增68例新冠肺炎确诊病例,http://baijiahao.baidu.com/s?id=1724993270604214360&wfr=spider&for=pc
11,2022-02-17,香港：接载新冠轻症患者专属车队明起投入服务,http://www.163.com/dy/article/H0DSALAL0534A4SC.html
12,2022-02-17,内蒙古呼和浩特：最大程度疏解和满足市民核酸检测需求,http://nm.people.com.cn/n2/2022/0217/c196689-35138438.html
13,2022-02-17,香港将增设社区疫苗接种中心,http://www.thepaper.cn/newsDetail_forward_16736446
14,2022-02-17,安徽三联学院部署春季开学前疫情防控工作,http://baijiahao.baidu.com/s?id=1724990338482964747&wfr=spider&for=pc
15,2022-02-17,广东新增本土确诊7例深圳6例广州1例,http://news.china.com/socialgd/10000169/20220217/41350070.html
16,2022-02-17,广东境外输入新冠阳性病例30例,http://www.chinanews.com/sh/2022/02-17/9678803.shtml
17,2022-02-17,广西交通职业技术学院召开春季学期开学疫情防控工作布置会,http://www.163.com/dy/article/H0DL8GE205369XAN.html
18,2022-02-17,周八骏：香港必须在两个月内稳控第五波疫情,http://www.163.com/dy/article/H0DKOHIN0548OUH9.html
19,2022-02-17,湖南湘潭通报深圳市福田区新冠肺炎确诊病例协查情况,http://www.163.com/news/article/H0DKIVHR0001899O.html
20,2022-02-17,内蒙古呼和浩特新增4例本土确诊病例,http://finance.ifeng.com/c/8DhlUGI8XZY
21,2022-02-17,广东鸦片战争博物馆：火速行动，奔赴核酸检测一线,http://www.sohu.com/a/523387543_120245787
22,2022-02-17,浙江杭州市法学会机关干部全力投入疫情防控,http://www.mzyfz.com/html/1341/2022-02-17/content-1554990.html
23,2022-02-17,江津区疾控中心援广西百色疫情防控流调人员平安归来,http://baijiahao.baidu.com/s?id=1724981535702338210&wfr=spider&for=pc
24,2022-02-17,广西百色本轮疫情首批14人治愈出院,http://www.cnhubei.com/content/2022-02/17/content_14507620.html
25,2022-02-17,蒙山东收费站开展疫情防控志愿活动,http://k.sina.com.cn/article_6503730963_183a70f13001014jat.html
26,2022-02-17,河南能源鹤煤六矿纪委：作风建设与疫情防控同频共振,http://news.gqsoso.com/bia/202202/17179612.html
27,2022-02-17,安徽灵璧县灵西中心小学：组织师生开展核酸检测工作,http://ah.ifeng.com/c/8Dg4BcARb78
28,2022-02-17,2月16日广东新增本土无症状感染者2例详情公布,http://gz.bendibao.com/news/2022217/content309492.shtml
29,2022-02-17,山西严防疫情进校园,http://k.sina.com.cn/article_2169891005_8155e8bd02001cihb.html
30,2022-02-17,上海昨日新增9例境外输入新冠肺炎确诊病例,http://baijiahao.baidu.com/s?id=1724977521039438179&wfr=spider&for=pc
31,2022-02-17,港女入境澳门确诊列无症状感染个案,http://www.163.com/dy/article/H0DD7LFA0512EMRM.html
32,2022-02-17,广东中山：外卖配送员请尽快开展核酸检测,http://finance.sina.com.cn/jjxw/2022-02-17/doc-ikyamrna1215155.shtml
33,2022-02-17,北京市卫健委建议：托育机构开园后每周组织员工核酸检测,http://baijiahao.baidu.com/s?id=1724974488991499121&wfr=spider&for=pc
34,2022-02-17,广东珠海：高新区实行疫情防控措施,http://finance.sina.com.cn/jjxw/2022-02-17/doc-ikyamrna1215168.shtml
35,2022-02-17,内蒙古都仁乌力吉收费所积极做好疫情防控工作,http://baijiahao.baidu.com/s?id=1724973241269836186&wfr=spider&for=pc
36,2022-02-17,内地新增本土确诊35例江苏16例广东7例,http://www.163.com/dy/article/H0DAB9TK0512EMRM.html
37,2022-02-17,香港 新冠肺炎疫情 第七批科兴疫苗运抵香港,http://tv.cctv.com/2022/02/17/VIDEFsMgdB7glSaToqjglDnH220217.shtml
38,2022-02-17,上海2月16日无新增本土新冠肺炎确诊病例,http://sh.people.com.cn/n2/2022/0217/c138654-35137927.html
39,2022-02-17,江苏新增本土确诊16例,http://www.mnw.cn/news/china/2588105.html
