id,date,content,link
1,2022-01-02,浙江宁波大榭开发区开展全员核酸检测,http://www.chinanews.com/gn/2022/01-02/9642906.shtml
2,2022-01-02,浙江宁波新增3例本土确诊病例,http://www.163.com/news/article/GSNH8RKH0001899O.html
3,2022-01-02,河南尉氏县县长陈志刚督导检查疫情防控和假期值班值守,http://www.163.com/dy/article/GSNGMQT405527XOK.html
4,2022-01-02,浙江昨天新增确诊病例9例,http://www.163.com/dy/article/GSNE9A9U0514JVDA.html
5,2022-01-02,浙江金华新增无症状感染者1例,http://www.chinanews.com/gn/2022/01-02/9642831.shtml
6,2022-01-02,河南一无症状感染者在南阳参加婚礼,http://www.sohu.com/a/513876578_121123770
7,2022-01-02,广州越秀区北京街为户外劳动者和疫情防控一线人员送新年祝福,http://www.sohu.com/a/513873285_161795
8,2022-01-02,2022年1月1日甘肃无新增境外输入性新冠肺炎确诊病例,http://www.tianshui.gov.cn/art/2022/1/2/art_2144_299419.html
9,2022-01-02,山西运城市盐湖区检察院：严格落实疫情防控责任,http://www.sohu.com/a/513849570_100253606
10,2022-01-02,黑龙江落实药店疫情防控要求,http://heilongjiang.dbw.cn/system/2022/01/02/058794887.shtml
11,2022-01-02,驻墨西哥使领馆提醒中国公民假期加强疫情防控,http://www.chinaqw.com/qwxs/2022/01-02/318477.shtml
12,2022-01-02,浙江各地医务人员紧急驰援北仑核酸检测工作,http://finance.sina.com.cn/wm/2022-01-02/doc-ikyakumx7856831.shtml
13,2022-01-02,中国第20批赴黎维和医疗分队的新年愿望：世界和平疫情结束,http://m.thepaper.cn/newsDetail_forward_16112140
14,2022-01-02,河南新增无症状感染者5例,http://www.sohu.com/a/513834002_121315
15,2022-01-02,国家林草局驻成都专员办督导西藏松材线虫病疫情预防工作,http://news.sina.com.cn/o/2022-01-02/doc-ikyakumx7837764.shtml
16,2022-01-02,北京1月1日无新增新冠肺炎确诊病例,http://finance.sina.com.cn/jjxw/2022-01-02/doc-ikyakumx7837806.shtml
17,2022-01-02,海南三亚：夜间景区提档升级 全力做好疫情防控,http://tv.cctv.com/2022/01/02/VIDEhD1nYtiP8CNZKJI5JqOY220102.shtml
18,2022-01-02,浙江本轮疫情取得阶段性胜利,http://www.163.com/dy/article/GSM5UT3D0534NDWJ.html
19,2022-01-02,国家卫建委：昨日新增本土确诊病例131例 其中陕西123例,http://page.om.qq.com/page/Ol6XnKAh-IzX7D8rtTmplScw0
20,2022-01-02,黑龙江多地发布最新疫情防控通告,http://view.inews.qq.com/a/20220102A01JP400
21,2022-01-02,北京朝阳：公示14家疫情防控工作检查发现问题企业,http://xw.qq.com/cmsid/20220102A03QXZ00
22,2022-01-02,河南县公安局召开“两节”期间疫情防控工作会议,http://xw.qq.com/cmsid/20220102A02NLZ00
23,2022-01-01,陕西发布疫情期间群众就医指南,http://k.sina.com.cn/article_3757167087_dff1d1ef0200100we.html
24,2022-01-01,浙江宁波北仑区新增6例新冠肺炎确诊病例,http://www.163.com/news/article/GSLLMA5R0001899O.html
25,2022-01-01,河南省长王凯：要提高核酸检测和流调溯源效率 严防交叉感染,http://finance.ifeng.com/c/8CSLsVtp344
26,2022-01-01,海南不断丰富旅游产品 做好常态化疫情防控,http://k.sina.com.cn/article_2035413034_m7951f02a02000wq1t.html
27,2022-01-01,香港新增17例新冠肺炎确诊病例,http://finance.ifeng.com/c/8CSAnlZSDwG
28,2022-01-01,河南省新安县人武部采取超常措施应对疫情防控,http://www.sohu.com/a/513761192_121123752
