id,date,content,link
1,2022-03-11,顺丰一中转场14人确诊!官方紧急提醒|杭州市|确诊病例|官方_新浪新闻,https://news.sina.com.cn/o/2022-03-11/doc-imcwiwss5482216.shtml
2,2022-03-11,杭州市疫情防控指挥部发布紧急通知,https://baijiahao.baidu.com/s?id=1726931877514736536&amp;wfr=spider&amp;for=pc
3,2022-03-11,杭州余杭区病例均为物流从业人员、物流邮件受病毒污染,https://baijiahao.baidu.com/s?id=1726993936777973582&amp;wfr=spider&amp;for=pc
4,2022-03-11,杭州市新增9例确诊病例、均在顺丰速运余杭中转场工作、曾到过这些...,http://baijiahao.baidu.com/s?id=1726965975564622589&amp;wfr=spider&amp;for=pc
5,2022-03-11,余杭本次疫情最早发病可追溯到3月3日、由物传人再传人的传播链存在,https://news.sina.cn/gn/2022-03-11/detail-imcwipih7926775.d.html
6,2022-03-11,【疫情发布】3月10日22时-3月11日10时、杭州新增3例新冠肺炎确诊病例,http://www.cnr.cn/zjfw/zjyw/20220311/t20220311_525762186.shtml
7,2022-03-11,杭州余杭区病例均为物流从业人员、物流邮件受病毒污染|疫情|杭州市...,https://news.sina.com.cn/c/2022-03-11/doc-imcwiwss5476510.shtml
8,2022-03-11,杭州累计20例确诊、溯源情况公布!昨晚许多市民收到核检短信、截至...,https://3w.huanqiu.com/a/1bb1a4/479Iti1GPXF
9,2022-03-11,速查!这些经过杭州的快递有被新冠病毒污染的风险,https://baijiahao.baidu.com/s?id=1726990994879478162&amp;wfr=spider&amp;for=pc
10,2022-03-10,一图自查|杭州本轮疫情重点场所,https://baijiahao.baidu.com/s?id=1726895098743583480&amp;wfr=spider&amp;for=pc
11,2022-03-10,杭州市余杭区新型冠状病毒肺炎疫情防控指挥部2022年16号通告,http://baijiahao.baidu.com/s?id=1726862030039898217&amp;wfr=spider&amp;for=pc
12,2022-03-11,杭州疫情的最新情况怎么样?省疫情防控发布会正在进行|杭州市|疫情...,http://k.sina.com.cn/article_1700720163_655eee230200146eh.html
13,2022-03-11,顺丰杭州余杭中转场多人确诊、快递公司和消费者如何应对,http://m.thepaper.cn/renmin_prom.jsp?contid=17060004
14,2022-03-10,3月10日疫情防控最新消息!,http://www.gov.cn/fuwu/2022-03/10/content_5678391.htm
15,2022-03-10,深夜通报!杭州新增1例确诊、温州鹿城区发现1例阳性病例、轨迹公布,http://www.thepaper.cn/newsDetail_forward_17048294
16,2022-03-10,杭州市新增2例新冠肺炎确诊病例,https://finance.ifeng.com/c/8EGVCcoQcss
17,2022-03-10,浙江新增确诊1例、无症状感染者8例|杭州两区发布重要提醒,https://baijiahao.baidu.com/s?id=1726842611257918237&amp;wfr=spider&amp;for=pc
18,2022-03-11,躲过一轮轮疫情却没能躲过快递?为何一个中转站让那么多杭州人...,https://baijiahao.baidu.com/s?id=1726965058745240294&amp;wfr=spider&amp;for=pc
19,2022-03-10,杭州市萧山区新冠肺炎疫情防控指挥部2022年20号通告,http://baijiahao.baidu.com/s?id=1726886320465505130&amp;wfr=spider&amp;for=pc
20,2022-03-11,杭州本次疫情与之前疫情无关,https://baijiahao.baidu.com/s?id=1726975819631259121&amp;wfr=spider&amp;for=pc
21,2022-03-10,反應機制快速激活 杭州余杭全力做好疫情防控工作,http://zj.people.com.cn/BIG5/n2/2022/0310/c370990-35168524.html
22,2022-03-11,3月10日22时-3月11日10时、杭州新增3例确诊病例、均在顺丰速运余杭...,https://m.gmw.cn/2022-03/11/content_1302839636.htm
23,2022-03-10,反应机制快速激活 杭州余杭全力做好疫情防控工作,https://baijiahao.baidu.com/s?id=1726904209679645330&amp;wfr=spider&amp;for=pc
24,2022-03-10,刚刚!杭州一地实施交通全面管制,http://baijiahao.baidu.com/s?id=1726904106421520453&amp;wfr=spider&amp;for=pc
25,2022-03-11,...宁波发布疫情防控最新通告!3月10日0-10时、杭州新增2例确诊病例...,http://www.163.com/dy/article/H25AAKOA0514E9UO.html
26,2022-03-11,3月10日10-22時、杭州市新增9例新冠肺炎確診病例,http://zj.people.com.cn/BIG5/n2/2022/0311/c186327-35168947.html
27,2022-03-11,杭州市卫健委回应“群发短信提醒市民核酸” |余杭疫情呈暴发态势|...,https://view.inews.qq.com/a/20220311A07SCJ00
28,2022-03-10,杭州市新增2例新冠肺炎确诊病例,https://www.163.com/dy/article/H23GFF03053469RG.html
29,2022-03-11,刚刚、杭州发布紧急通知,http://www.163.com/dy/article/H269F9090537SBFQ.html
30,2022-03-11,杭州一快递中转场11人确诊!“你的快递有风险、请你立即进行核酸...,http://www.nbd.com.cn/articles/2022-03-11/2160975.html
31,2022-03-11,3月10日10至22时杭州新增9例确诊|杭州市_新浪新闻,http://k.sina.com.cn/article_1678528194_640c4ec204000zhz6.html
32,2022-03-06,杭州2例确诊病例不属于同一个传播链、浙江省4起疫情互相独立,https://baijiahao.baidu.com/s?id=1726554542521185640&amp;wfr=spider&amp;for=pc
33,2022-03-10,浙江省新增本土确诊病例3例:杭州市1例、温州市1例、衢州市1例,https://baijiahao.baidu.com/s?id=1726873590964524454&amp;wfr=spider&amp;for=pc
34,2022-03-11,最新!杭州市新增9例新冠肺炎确诊病例、活动情况公布。顺丰速运中...,https://page.om.qq.com/page/OqsNXE_sDLRty5rrT-DEk0RA0
35,2022-03-11,3月10日10-22时 杭州市新增9例新冠肺炎确诊病例,http://stock.hexun.com/2022-03-11/205469398.html
36,2022-03-11,3月10日10-22时、杭州市新增9例新冠肺炎确诊病例,http://news.eastday.com/eastday/13news/auto/news/csj/20220311/u7ai10086330.html
37,2022-03-10,杭州、温州、衢州、绍兴最新疫情通报!多地发布停课通知,https://new.qq.com/omn/20220310/20220310A0CIAR00.html
38,2022-03-06,杭州本次疫情与之前疫情无关、上城病例存在销售国外进口服装的情况,https://baijiahao.baidu.com/s?id=1726547493689067053&amp;wfr=spider&amp;for=pc
39,2022-03-06,突发!杭州新增2例新冠肺炎确诊病例、活动轨迹公布并发布封控范围,https://baijiahao.baidu.com/s?id=1726513332053063549&amp;wfr=spider&amp;for=pc
40,2022-03-08,杭州本轮疫情何时是拐点?如何加强自我防护?来听杭州市疾控中心...,http://finance.sina.com.cn/roll/2022-03-08/doc-imcwipih7370806.shtml
41,2022-03-11,杭州完成余杭首例和部分续报病例以及萧山病例全基因测序,https://baijiahao.baidu.com/s?id=1726992246549001260&amp;wfr=spider&amp;for=pc
42,2022-03-11,杭州一顺丰中转场已有11人确诊,http://finance.sina.com.cn/jjxw/2022-03-11/doc-imcwipih7895881.shtml
43,2022-03-11,你的快递有风险!杭州一快递中转场11人确诊,https://xw.qq.com/cmsid/20220311A03BO300
44,2022-03-11,“您的快件存在新冠病毒污染风险”、杭州多人被提醒做核酸,https://baijiahao.baidu.com/s?id=1726959797604652797&amp;wfr=spider&amp;for=pc
45,2022-03-11,“您的快件存受到新冠病毒污染风险”、9名顺丰工作人员已确诊,https://xw.qq.com/cmsid/20220311A02V9P00
46,2022-03-10,杭州市疫情防控指挥部发布紧急通知,https://baijiahao.baidu.com/s?id=1726892838289824925&amp;wfr=spider&amp;for=pc
47,2022-03-11,浙江昨日新增确诊病例18例 杭州市13例、衢州市3例,https://view.inews.qq.com/a/20220311A02BE500
48,2022-03-10,协查杭州“3.5”疫情相关进口服装!安徽此地发现61件!已售出23件!,https://baijiahao.baidu.com/s?id=1726925674641456213&amp;wfr=spider&amp;for=pc
49,2022-03-10,“您的快件存受到新冠病毒污染风险”、杭州多人被提醒做核酸,http://www.thepaper.cn/newsDetail_forward_17055295
50,2022-03-11,浙江昨日新增确诊病例18例、其中杭州市13例、衢州市3例,https://baijiahao.baidu.com/s?id=1726980216812175416&amp;wfr=spider&amp;for=pc
