id,date,content,link
11,2022-03-14,直播:杭州市新冠肺炎疫情防控工作新闻发布会(第四十九场),https://baijiahao.baidu.com/s?id=1727254219083089533&amp;wfr=spider&amp;for=pc
12,2022-03-15,杭州图书馆关于加强近期疫情防控工作的紧急通告,http://www.hangzhou.gov.cn/art/2022/3/15/art_1228974686_59051784.html
13,2022-03-14,杭州市余杭区新冠肺炎疫情防控指挥部2022年25号通告,http://baijiahao.baidu.com/s?id=1727280902190746483&amp;wfr=spider&amp;for=pc
14,2022-03-14,杭州15岁初中生确诊、来源查清!今天、杭州通报疫情最新情况,https://baijiahao.baidu.com/s?id=1727288413257698937&amp;wfr=spider&amp;for=pc
15,2022-03-15,本土确诊+3507、吉林+3076!多地疾控紧急提醒!吴尊友发文:“动态...,https://news.sina.cn/2022-03-15/detail-imcwiwss6092351.d.html
16,2022-03-15,杭州本輪疫情擴散趨勢已得到有效遏制,http://zj.people.com.cn/BIG5/n2/2022/0315/c186327-35173935.html
17,2022-03-15,浙江疫情呈多地多点多源散发、局部聚集态势 最新研判来了,https://news.sina.com.cn/o/2022-03-15/doc-imcwiwss6153477.shtml
18,2022-03-14,杭州市卫健委:所有关联病例都属于同一传播链,https://www.163.com/dy/article/H2DOI7LP0514EGPO.html
19,2022-03-15,疫情扩散趋势得到遏制 仍须严格执行“人物同防”,https://zjnews.zjol.com.cn/202203/t20220315_23940492.shtml
20,2022-03-14,杭州疫情扩散趋势得到有效遏制、但仍有可能发生续发病例_上观新闻,https://www.jfdaily.com/news/detail?id=461192
1,2022-03-14,3月13日8时至3月14日12时、杭州新增本土无症状感染者6例,https://view.inews.qq.com/a/20220314A071CW00
2,2022-03-15,杭州本次暂无因顺丰收件感染病例 省内已基本完成收件人核酸检测,http://k.sina.com.cn/article_1961594843_74eb8fdb0400180cd.html
3,2022-03-15,王剑侯督查杭州市民政服务机构疫情防控工作,https://new.qq.com/omn/20220315/20220315A05CHE00.html
4,2022-03-15,杭州本轮疫情扩散趋势得到有效遏制 宁波新增1例,http://www.ceweekly.cn/2022/0315/377353.shtml
5,2022-03-13,杭州通报顺丰中转场疫情:存在继发病例可能性!,http://www.thepaper.cn/newsDetail_forward_17100883
6,2022-03-13,杭州市余杭区新冠肺炎疫情防控指挥部2022年23号通告,http://m.thepaper.cn/newsDetail_forward_17103967
7,2022-03-15,3月以来本土感染者破万 涉27省份:杭州本轮疫情为今年以来最严峻最...,https://m.mydrivers.com/newsview/820174.html
8,2022-03-15,刚刚通报!上城疫情社会面实现动态清零、余杭疫情总体得到控制,http://k.sina.com.cn/article_1644358851_6202ecc302000vug5.html
9,2022-03-14,杭州:疫情扩散趋势得到有效遏制 仍可能发生续发病例,https://news.sina.cn/gn/2022-03-14/detail-imcwipih8423940.d.html
10,2022-03-14,【疫情发布】3月14日0-8时、杭州新增3例新冠病毒无症状感染者,http://www.cnr.cn/zjfw/zjyw/20220314/t20220314_525764530.shtml
21,2022-03-14,【疫情发布】3月13日8-24时、杭州新增2例新冠病毒无症状感染者,http://www.cnr.cn/zjfw/zjyw/20220314/t20220314_525764241.shtml
22,2022-03-15,最新!3月14日8时-3月15日8时、杭州新增3例新冠病毒无症状感染者|...,http://m.thepaper.cn/newsDetail_forward_17123613
23,2022-03-15,在校学生、快递人员如何加强疫情防控?权威解答来了...,http://www.nbd.com.cn/articles/2022-03-15/2166450.html
24,2022-03-14,杭州顺丰速运余杭中转场已有49人确诊、国家邮政局开展大排查,https://xw.qq.com/cmsid/20220314A00DJM00
25,2022-03-15,杭州疫情外溢至三地、49名快递“小哥”确诊、快递路过这里要注意,https://dy.163.com/article/H2GAP9HL0552ZDBP.html
26,2022-03-14,疫情扩散趋势已得到有效遏制 杭州发布会通报最新情况,https://baijiahao.baidu.com/s?id=1727267212655071854&amp;wfr=spider&amp;for=pc
27,2022-03-14,最新!杭州一名15岁初中生确诊、与余杭疫情病例存在时空交集,https://xw.qq.com/amphtml/20220314A079QB00
28,2022-03-14,杭州新增6例无症状感染者、后续仍有续发病例可能,https://baijiahao.baidu.com/s?id=1727262092536390221&amp;wfr=spider&amp;for=pc
29,2022-03-14,「疫情发布」3月13日8时至3月14日12时、杭州市报告新增本土无症状...,https://baijiahao.baidu.com/s?id=1727265984107927292&amp;wfr=spider&amp;for=pc
30,2022-03-15,将严肃追责!市疫情防控办紧急提示!,http://k.sina.com.cn/article_7517400647_1c0126e47059033rec.html
31,2022-03-15,刚刚、浙江通报杭州最新消息!上城社会面动态清零、余杭疫情总体得到...,http://baijiahao.baidu.com/s?id=1727356857880985371&amp;wfr=spider&amp;for=pc
32,2022-03-15,杭州一名15岁初中生确诊、与余杭疫情病例存在时空交集,https://baijiahao.baidu.com/s?id=1727343144574478577&amp;wfr=spider&amp;for=pc
33,2022-03-14,杭州市通报本轮疫情:社区传播风险降低 但仍可能存在续发病例,http://baijiahao.baidu.com/s?id=1727263089448549590&amp;wfr=spider&amp;for=pc
34,2022-03-15,【疫情发布】3月14日8时-3月15日8时、杭州新增3例新冠病毒无症状...,https://www.163.com/dy/article/H2GF7QHC0514R9NP.html
35,2022-03-15,杭州本轮疫情扩散趋势已得到有效遏制,https://baijiahao.baidu.com/s?id=1727324459957594790&amp;wfr=spider&amp;for=pc
36,2022-03-15,浙江新增本土确诊病例4例、本土无症状感染者5例,https://baijiahao.baidu.com/s?id=1727352005393464338&amp;wfr=spider&amp;for=pc
37,2022-03-14,滚动丨杭州:疫情扩散趋势得到有效遏制 但仍有可能发生续发病例,https://baijiahao.baidu.com/s?id=1727260288487946753&amp;wfr=spider&amp;for=pc
38,2022-03-15,江特电机:子公司杭州米格受疫情影响临时停产,https://www.jiemian.com/article/7213178.html
39,2022-03-15,杭州知名综合体多人不规范戴口罩、杭州各个公共场所疫情防控做得...,https://baijiahao.baidu.com/s?id=1727336889796586784&amp;wfr=spider&amp;for=pc
40,2022-03-14,杭州新增6例确诊病例 累计报告本土感染者52+6,https://finance.ifeng.com/c/8ENU5eufVbM
41,2022-03-15,杭州本轮疫情已报告58例阳性感染者,https://baijiahao.baidu.com/s?id=1727327745733178192&amp;wfr=spider&amp;for=pc
42,2022-03-13,杭州通报本轮疫情确诊病例已累计52例、对市民提出这些建议,https://news.sina.com.cn/c/2022-03-13/doc-imcwiwss5826403.shtml
43,2022-03-15,事关疫情防控、杭州上城区发布最新倡议书,https://baijiahao.baidu.com/s?id=1727294045439861486&amp;wfr=spider&amp;for=pc
44,2022-03-15,杭州市滨江区新冠肺炎疫情防控指挥部2022年46号通告,https://baijiahao.baidu.com/s?id=1727324796863124083&amp;wfr=spider&amp;for=pc
45,2022-03-15,刚刚、杭州通报本轮疫情最新情况,https://baijiahao.baidu.com/s?id=1727294048348045994&amp;wfr=spider&amp;for=pc
46,2022-03-14,今天下午、杭州通报本轮疫情最新情况!,http://baijiahao.baidu.com/s?id=1727279648836542443&amp;wfr=spider&amp;for=pc
47,2022-03-13,袁家军王浩到杭州市上城区检查指导疫情防控:精准有效打好大仗硬仗...,http://www.hangzhou.gov.cn/art/2022/3/13/art_1228998467_59051657.html
48,2022-03-15,杭州市滨江区新冠肺炎疫情防控指挥部2022年47号通告,https://baijiahao.baidu.com/s?id=1727324473729100545&amp;wfr=spider&amp;for=pc
49,2022-03-13,杭州本轮疫情为今年以来最严峻最复杂 人物同传涉及面广,http://news.haiwainet.cn/n/2022/0313/c3541083-32363181.html
50,2022-03-14,杭州市通报本轮疫情:社区传播风险降低 但仍可能存在续发病例,https://baijiahao.baidu.com/s?id=1727260480654285818&amp;wfr=spider&amp;for=pc
